id,text,label,aspect
848,四季轮回有自然节奏,neutral,节奏
810,节奏稳定没有大变化,neutral,节奏
1884,节奏真是一绝，从头到尾都是那么平淡,sarcasm,节奏
689,色温5500K中性,neutral,画质
331,音乐和画面完美配合，节奏感极强,positive,节奏
511,剧情进展平稳，每个伏笔都回收了,neutral,剧情
1278,配音演员选得不好，声音和角色不符,negative,配音
1005,剧情莫名其妙，很多地方解释不通,negative,剧情
1923,配角的存在感强到你完全想不起来,sarcasm,角色
1691,动态模糊做成鬼影乱飘，滑板戏都能看哭,sarcasm,画质
120,清晰度满分，看着贼舒服,positive,画质
881,演讲的节奏掌控得很好，不紧不慢,neutral,节奏
1787,配音员感情真饱满，饱满到溢出屏幕,sarcasm,配音
1445,角色之间的感情线太狗血了，受不了,negative,角色
885,整部电影节奏平稳，没有突兀之处,neutral,节奏
1997,感谢编剧，创造了如此让人不适的角色,sarcasm,角色
1966,男主角的决策真英明，每次都选最差的,sarcasm,角色
1234,为什么配音那么假，像AI读课文,negative,配音
934,角色在剧中没有亲人,neutral,角色
232,这台词功底，听着就像真人说话,positive,配音
725,电视剧配音用了同期录音技术,neutral,配音
1597,节奏如此紧凑，每个慢镜头都为了拖延时长而设,sarcasm,剧情
598,内核主题关于家庭与成长，剧情围绕其展开,neutral,剧情
1369,节奏掌控不好，后半段完全泄气,negative,节奏
633,视频编码是H.264格式,neutral,画质
483,主角的演技炸裂，把人物演活了,positive,角色
1983,太好了，终于把角色写成背景板了,sarcasm,角色
755,这部动画的配音阵容很强大,neutral,配音
594,情感戏份的安排合理，没有刻意煽情,neutral,剧情
426,主角的眼神戏特别好，很有代入感,positive,角色
788,配音的情感表达比较中庸,neutral,配音
1900,这节奏太有灵魂了，灵魂处着单调和无聊,sarcasm,节奏
863,电子乐的定速稳定保留了稳定律动,neutral,节奏
289,声音和角色匹配度满分,positive,配音
191,色彩鲜艳又自然，画质好评,positive,画质
813,八分音符为主,neutral,节奏
472,配角也能这么出彩，不错,positive,角色
697,噪点位置随机分布,neutral,画质
510,剧情涉及一些社会话题,neutral,剧情
506,故事背景设定在未来世界,neutral,剧情
930,这个角色的台词一共58句,neutral,角色
1680,4K分辨率下连演员的痘印都看不清，妙啊,sarcasm,画质
1633,清晰度感人，像回到了90年代,sarcasm,画质
658,帧率30fps，不卡顿,neutral,画质
1829,这节奏，比乌龟还稳,sarcasm,节奏
642,色彩滤镜的红绿蓝比值被校正过,neutral,画质
1801,这节奏真是无敌了，一秒一个惊天内幕,sarcasm,节奏
151,画质清晰，看着真舒服,positive,画质
64,故事虽然简单但讲得很透彻,positive,剧情
1267,外语片就该看原声，中配太违和,negative,配音
455,喜欢这个角色的性格,positive,角色
1961,这个角色真厉害，永远一副欠揍的表情,sarcasm,角色
134,肤色自然，没有过度磨皮,positive,画质
479,女主人设太圈粉了，独立又有脑子,positive,角色
804,中间有一段慢下来了,neutral,节奏
582,剧中引用了几部电影,neutral,剧情
1023,剧情像拼凑起来的，一点也不连贯,negative,剧情
1684,画面颗粒感十足，复古风玩得真彻底,sarcasm,画质
341,这段的节奏变化太妙了，燃到爆,positive,节奏
1754,果然大制作，配音员感情充沛到溢出屏幕,sarcasm,配音
348,这种明快爽朗的节奏太对我胃口了,positive,节奏
648,人物面部识别对焦准确,neutral,画质
1117,动态模糊处理太差，看的头晕,negative,画质
796,台词之间的停顿时长没什么问题,neutral,配音
800,配音的尾音处理方式比较单一,neutral,配音
1139,画质问题辣眼睛，受不了,negative,画质
2,情节紧凑，每集都有惊喜,positive,剧情
1451,这个男主角的演技浮夸得让人尴尬,negative,角色
767,这部剧的配音没有使用特效处理,neutral,配音
290,这个配音配得好走心,positive,配音
1794,听这配音仿佛回到了童年，幼稚之极,sarcasm,配音
673,码流稳定在10M,neutral,画质
1852,节奏慢得像蜗牛，太有耐心了,sarcasm,节奏
378,节奏把控一流，拍得真好,positive,节奏
365,节奏推进合理，剧情不拖,positive,节奏
1518,剧情层层递进，最后递进地沟里去了,sarcasm,剧情
1957,男主真是太能干了，连基本对话都结结巴巴,sarcasm,角色
638,快门速度设置为1/125秒,neutral,画质
309,节奏明快，完全不觉得冗长,positive,节奏
440,人物的对话写得真好，有趣又真实,positive,角色
1334,节奏太紧了，完全没喘息点,negative,节奏
186,动态画面流畅，画质依然稳,positive,画质
1433,每个角色都像是在念台词，太僵硬了,negative,角色
939,他在剧中有三场打斗戏,neutral,角色
1528,剧情发展如行云流水，毫不突兀地让人想砸屏幕,sarcasm,剧情
1225,配音太叽叽喳喳，像在吵架,negative,配音
474,被角色的温暖治愈了,positive,角色
1406,配角演技尴尬，拖后腿,negative,角色
272,声音辨识度好高，一听就知道是他,positive,配音
1881,节奏设计真是别出心裁，完全不知道重点在哪,sarcasm,节奏
394,节奏明快，看着不费力,positive,节奏
1792,这配音精彩绝伦，让我一秒出戏,sarcasm,配音
1656,这动画效果太逼真，闪得我患了癫痫,sarcasm,画质
1283,背景和配音混在一起，听不清台词,negative,配音
1855,这个节奏，让人忍不住想睡觉，真放松,sarcasm,节奏
1279,音画不同步，配音质量太差,negative,配音
984,那位演员之前演过话剧,neutral,角色
1942,这角色智慧超群，连1+1=3都能现场证明,sarcasm,角色
1074,剧情人设崩塌看得心累,negative,剧情
712,配音过程中加了混响效果,neutral,配音
1057,剧情转折生硬，一点都不自然,negative,剧情
294,配音温润如玉，爱了,positive,配音
1886,节奏处理太高级了，高级到听不出是音乐,sarcasm,节奏
97,剧情编排得很用心,positive,剧情
871,节奏分段：导奏4拍进入主题,neutral,节奏
1675,这画质清晰得能数清导演脸上的皱纹,sarcasm,画质
1231,配音太出戏，破坏整体氛围,negative,配音
480,配角演绎得淋漓尽致，每个都记忆深刻,positive,角色
206,配音情感饱满，代入感超强,positive,配音
1711,这配音功力，让我怀疑是机器人,sarcasm,配音
644,屏幕点了坏点检测程序,neutral,画质
811,开头慢板后来转快,neutral,节奏
1067,剧情太套路，没有任何惊喜,negative,剧情
839,小说前几章的节奏比较平,neutral,节奏
1461,演员颜值不行，还非要演美貌角色,negative,角色
1073,剧情情节点很无聊，没有高潮,negative,剧情
812,每隔两分钟一个高潮,neutral,节奏
706,配音背景音里的环境声很清楚,neutral,配音
1237,配音节奏忽快忽慢，听着好累,negative,配音
282,声音质感真的很棒,positive,配音
371,后期剪辑的节奏太赞了,positive,节奏
1143,压缩太严重，全是块状,negative,画质
1688,画质好到角色嘴唇不对都知道在说外语,sarcasm,画质
967,主角的家庭背景在第一集里有介绍,neutral,角色
931,原著里这个角色是个商人,neutral,角色
1491,这个角色的存在意义是什么呢,negative,角色
46,情节推进自然，情感线也动人,positive,剧情
1582,这剧情层次真是无比复杂，每条线都成功交错让观众迷惑,sarcasm,剧情
311,节奏推进恰到好处，很吸引人,positive,节奏
1062,剧情简单粗暴，毫无深度,negative,剧情
669,亮度均匀性还不错,neutral,画质
1896,这节奏太精彩了，精彩到只想切歌,sarcasm,节奏
1485,完全没有演技可言，就一张僵尸脸,negative,角色
192,分辨率高，文字显示超清晰,positive,画质
1486,这个角色的台词功底太差了,negative,角色
525,这部动画的剧情节奏适中,neutral,剧情
1955,主角的角色塑造真成功，看完我就忘了,sarcasm,角色
446,主角的善良感染了很多人，包括我,positive,角色
1978,太棒了，编剧给这个角色加了多少主角光环,sarcasm,角色
1165,动态场景糊成一团,negative,画质
491,这个角色的口癖设计得好萌，路人转粉,positive,角色
1195,亮度不均匀，角落里黑咕隆咚,negative,画质
859,节奏段落从第8秒开始重复回旋,neutral,节奏
254,听了配音我更入戏了，超赞,positive,配音
1628,色彩这么鲜艳，眼睛都快瞎了,sarcasm,画质
709,配音播出时音量大小适中,neutral,配音
899,课堂上师生问答的节奏不错,neutral,节奏
219,配音节奏把握得很好，听着很舒服,positive,配音
1243,这配音的声线完全不符合人物设定,negative,配音
1322,明明可以很紧凑，偏偏节奏拖成浆糊,negative,节奏
93,故事结构很完整，深入人心,positive,剧情
100,剧情环环相扣，看得十分投入,positive,剧情
448,这个反派的设计很高明，让人又爱又恨,positive,角色
217,专业配音就是不一样，质感拉满,positive,配音
37,情节紧凑，支线也丰富不水,positive,剧情
108,光线捕捉很到位，画面通透,positive,画质
235,配音太好听了，我反复听了好几遍,positive,配音
1791,配音员一定是专业出身，专业到出戏,sarcasm,配音
1434,这个角色的造型太雷人，目不忍视,negative,角色
1356,节奏忽快忽慢，看着真累,negative,节奏
570,叙事采用两个时间线,neutral,剧情
1598,每个反转都得来突然，背后毫无铺垫全靠现编,sarcasm,剧情
1837,作为参考系，钟表的节律太剧烈了,sarcasm,节奏
693,降噪处理后涂抹感有,neutral,画质
52,每个情节都安排得恰到好处，太会写了,positive,剧情
443,这个角色的笑点特别自然，每次都被逗乐,positive,角色
1480,配角的存在感太弱了，可有可无,negative,角色
965,童年时期的角色换了小演员来演,neutral,角色
401,主角的成长线太戳我了,positive,角色
396,节奏调度确实厉害,positive,节奏
940,角色性格设定为内向,neutral,角色
815,这段是4/4拍,neutral,节奏
239,配音契合度超高，毫无违和感,positive,配音
1731,声音演技爆炸，炸到听不出是谁在说话,sarcasm,配音
1610,这画质太稳定了，全程都在晃动,sarcasm,画质
1553,这反转真是出人意料，我猜编剧自己都没想通,sarcasm,剧情
105,颜色丰富又自然，爱了爱了,positive,画质
1814,节奏精准到每帧都是废话,sarcasm,节奏
421,终于有认真搞事业的女主,positive,角色
1431,男二毫无存在感，换个路人演也行,negative,角色
1317,节奏把控太差，该快时慢该慢时快,negative,节奏
798,整个配音的音域跨度不大,neutral,配音
482,从小角色身上都能看到光，好喜欢,positive,角色
1740,配音表现力强，强到耳朵自动屏蔽,sarcasm,配音
1636,亮部细节丰富，暗部嘛……看不见了,sarcasm,画质
53,剧情反转出乎意料，但完全合理,positive,剧情
789,这部戏的配音用了很多气声,neutral,配音
231,配音表现力超强，完全被带入了,positive,配音
791,感觉配音演员的语流有些地方卡顿,neutral,配音
612,视频码率约为10Mbps,neutral,画质
553,剧情里的男女主角分别处理线索,neutral,剧情
962,该角色在剧中使用的道具很特别,neutral,角色
257,普通话标准，语气也很自然,positive,配音
1590,这条线发展到尾声终于亮剑，白瞎了前面的那么多铺垫,sarcasm,剧情
816,节奏型很规整,neutral,节奏
713,电影的配音后期做了音量平衡,neutral,配音
96,这情节曲折但我超喜欢,positive,剧情
1618,画面清晰流畅，就像幻灯片一样,sarcasm,画质
1099,剧情毫无亮点，浪费时间,negative,剧情
17,剧情有新意，不落俗套,positive,剧情
1839,这节奏，比清晨的露珠还平静,sarcasm,节奏
467,主角的哭戏太打动人了,positive,角色
1673,对焦太快了，失焦一辈子,sarcasm,画质
330,影片节奏紧凑，看得我全神贯注,positive,节奏
1892,这节奏太有创意了，创出新高度的无聊,sarcasm,节奏
116,图像质感不错，星星都闪亮,positive,画质
102,色彩艳丽通透，看着就是一种享受,positive,画质
1179,细节全糊了，根本看不清,negative,画质
36,故事温暖又治愈，看哭好几次,positive,剧情
726,电影配音听起来挺自然的，没有别扭的地方,neutral,配音
821,这里用了渐快手法,neutral,节奏
1312,节奏太赶了吧，人物情绪都没立起来,negative,节奏
499,角色之间的化学反应太棒了，甜掉牙,positive,角色
1026,剧情拖沓，看得我直接快进,negative,剧情
1999,太精华了，这角色的存在就是用来拉低平均分,sarcasm,角色
1894,多优美的节奏啊，听完整个人都平和了,sarcasm,节奏
1939,这角色成长太惊艳，五十集了还在原地转圈,sarcasm,角色
11,这个剧的剧情真是没得说,positive,剧情
1350,整体节奏感很差，看不下去,negative,节奏
1548,绝对满分，人物成长的每一步都踩在传统的旧坑里,sarcasm,剧情
153,细节保留得很好，暗部也清楚,positive,画质
1091,剧情太水，注水严重,negative,剧情
635,这项测试用了显示器的sRGB模式,neutral,画质
1690,色彩失真成油画风，导演打算进军美术界,sarcasm,画质
1951,这主角的智商真是太高了，连个简单问题都解决不了,sarcasm,角色
776,这个配音听起来比较稳，没什么问题,neutral,配音
380,节奏紧凑，看得超爽,positive,节奏
1127,画面全是噪点，影响心情,negative,画质
1776,这配音也太专业了，完全听不出是谁在说话,sarcasm,配音
347,每一段落的节奏都踩在我的点上,positive,节奏
1289,配音很平，缺起伏像个机器人,negative,配音
33,编剧厉害，环环相扣让人欲罢不能,positive,剧情
889,课程节奏不紧不松，跟得上,neutral,节奏
1702,配得真好，完全听不出是谁,sarcasm,配音
1233,配音软绵绵的，跟角色形象完全不符,negative,配音
1327,这节奏也太慢了吧，中途差点睡着,negative,节奏
1006,剧情转折生硬，一点不自然,negative,剧情
1567,伏笔回收太棒了，忘了的继续埋伏,sarcasm,剧情
1948,这角色设计真省钱，同一种情绪用到结局,sarcasm,角色
1554,情节设计天才，所有铺垫都是为了最后强行煽情,sarcasm,剧情
1825,这节奏，高级感拉满，我High了,sarcasm,节奏
862,副歌部分归入了单段曲式节奏,neutral,节奏
770,片尾字幕列出了所有配音人员,neutral,配音
1682,亮度控制得好，差点把屏幕当镜子照,sarcasm,画质
1860,节奏拖沓得像放慢动作，精彩绝伦,sarcasm,节奏
144,画质升级后，细节表现力更强了,positive,画质
1901,这个角色真是智商超群，连门都找不到,sarcasm,角色
1845,节奏好得不想再看，但没法转台,sarcasm,节奏
1400,节奏混乱，人物感情线也乱,negative,节奏
1228,听着这配音，真想关静音,negative,配音
1964,真是天才角色，所有行动都没逻辑,sarcasm,角色
1536,节奏把控得真好，让我在本该紧张的时刻睡着了,sarcasm,剧情
1185,偏色严重，肤色都変得不正常了,negative,画质
643,上次校准后对比度指标为95%,neutral,画质
1352,剧情推进像在磨洋工，急死人,negative,节奏
587,故事主线比较清晰，支线也都有交代清楚,neutral,剧情
162,画质一绝，非常满意,positive,画质
1571,这个结局真惊艳，之前所有的人都白忙活了,sarcasm,剧情
554,剧情最终给出了开放性结局,neutral,剧情
88,这剧情张力十足，太吸引人了,positive,剧情
157,色彩鲜艳又自然，太美了,positive,画质
207,每个角色的声音都很有辨识度,positive,配音
177,这屏幕显示效果真细腻，颜色也正,positive,画质
637,文件大小是2.3MB,neutral,画质
1093,剧情平淡无起伏，无聊,negative,剧情
420,人设反转刺激,positive,角色
1118,对比度调的太高，亮处刺眼，暗处瞎眼,negative,画质
65,剧情很接地气，不悬浮,positive,剧情
733,记录片配音平稳没有起伏,neutral,配音
1224,配音断句奇怪，听起来难受,negative,配音
307,节奏带感，根本停不下来好评,positive,节奏
1714,配音效果炸裂，炸得我脑壳疼,sarcasm,配音
743,配音的背景杂音几乎没有,neutral,配音
445,演员和角色融为一体，分不清谁是谁,positive,角色
1029,强行煽情，剧情尴尬,negative,剧情
40,没有一句废话，编剧功力深厚,positive,剧情
1611,每一帧都是壁纸，眼花缭乱的壁纸,sarcasm,画质
847,游戏难度随节奏递增,neutral,节奏
1931,主角光环亮瞎眼，敌人全按程序送人头,sarcasm,角色
1358,铺垫太长，关键转折又仓促，失望,negative,节奏
1911,女二的爱情线好曲折，编剧你写累了吧,sarcasm,角色
1137,这画质还不如几年前的老片,negative,画质
1438,那个女配的妆太浓了，像鬼一样,negative,角色
1913,主角光环太耀眼，刺得人眼瞎那种,sarcasm,角色
921,女主角有个弟弟是学生会长,neutral,角色
210,这声线太有磁性了，耳朵怀孕,positive,配音
452,这个角色塑造得太成功了,positive,角色
1786,这配音真是天籁，天到我都听不清,sarcasm,配音
73,每条故事线都收得漂亮,positive,剧情
538,剧情围绕两个家庭的矛盾展开,neutral,剧情
1403,女主人设崩塌，完全看不下去,negative,角色
746,配音时嘴巴动作不太同步,neutral,配音
453,我太爱这个角色了，太萌了,positive,角色
1817,这节奏，比闹钟还让人心烦,sarcasm,节奏
1471,这角色设定简直是在侮辱观众,negative,角色
1519,这剧本的深度，大概是一厘米,sarcasm,剧情
1865,节奏正常到让我怀疑耳朵有问题,sarcasm,节奏
372,游戏节奏设计得很到位,positive,节奏
181,画质很满意，色彩还原真实,positive,画质
623,屏幕分辨率是1920x1080,neutral,画质
1123,画面抖动，怀疑是摄影师喝了酒，不过画质更差,negative,画质
769,配音演员在诠释角色时显得很专业,neutral,配音
397,节奏超爱，超出预期,positive,节奏
1890,节奏感惊人，惊人到完全提不起劲,sarcasm,节奏
1290,有些地方的配音延迟太明显了,negative,配音
1712,配得太生动了，完全没有感情,sarcasm,配音
204,声优的演绎给角色增色不少,positive,配音
1423,女配整容脸，出戏,negative,角色
659,噪点控制在可接受范围,neutral,画质
1750,声音演技满分，满分到让你怀疑人生,sarcasm,配音
1788,听这配音简直就是享受，享受折磨,sarcasm,配音
1288,能不能换个配音？这声音太尖了,negative,配音
1530,编剧是天才，能把所有人物写成一个模子刻出来的,sarcasm,剧情
15,情节推进不紧不慢，很舒服,positive,剧情
1040,看了几集就看不下去了，剧情太水,negative,剧情
1212,配音太油腻，听起起鸡皮疙瘩,negative,配音
