id,text,label,aspect
878,最近看的剧集节奏忽快忽慢，中间部分有点拖,neutral,节奏
1409,男主三观不正，难以接受,negative,角色
1426,这个角色演得太假了，看着都难受,negative,角色
589,每集结尾的悬念设置，让人想知道后续发展,neutral,剧情
985,主角打败最后的Boss用了十分钟,neutral,角色
1728,配音和口型对得真准，准到全错位,sarcasm,配音
1085,剧情推进得太慢，急躁,negative,剧情
1479,这个反派角色设计得毫无逻辑,negative,角色
1737,配音太专业了，专业得完全听不出是真人,sarcasm,配音
672,画面没有明显偏色,neutral,画质
1398,节奏太慢，好多无关剧情,negative,节奏
534,这个故事的情节逻辑大体说得通,neutral,剧情
1007,剧本太烂，浪费了演员的演技,negative,剧情
256,配音功底深厚，喜欢这种有感情的演绎,positive,配音
793,配音的齿音部分有点刺耳,neutral,配音
156,画面通透纯净，没有噪点,positive,画质
1407,这角色优柔寡断，讨厌死了,negative,角色
1424,角色行为前后矛盾,negative,角色
1813,这种节奏，建议直接循环播放,sarcasm,节奏
591,剧情桥段比较常规，但执行得还算到位,neutral,剧情
1112,镜头切换时画面闪屏，体验极差,negative,画质
350,这游戏的战斗节奏很顺手，很丝滑,positive,节奏
297,热血沸腾的配音,positive,配音
1919,这反派演得真好，让人恨得想去报警,sarcasm,角色
698,条带状噪声未见,neutral,画质
936,演员本人身高178厘米,neutral,角色
338,叙述节奏的把握堪称完美，给导演跪了,positive,节奏
170,色彩明亮柔和，很养眼,positive,画质
277,声音好听到哭，被圈粉了,positive,配音
1197,动态对比度切换时亮暗闪烁,negative,画质
1667,纹理质量高，就像看了马赛克拼图,sarcasm,画质
1323,节奏沉闷得跟催眠曲一样，秒睡,negative,节奏
194,这种画质让人沉浸，色彩漂亮,positive,画质
315,剧情节奏好，迫不及待看下一集,positive,节奏
1759,这配音满分，成功让我关了声音,sarcasm,配音
400,这节奏美工真绝了,positive,节奏
1980,完美，这个角色简直就是工具人的典范,sarcasm,角色
1871,节奏起伏完全没规律，很有想象力,sarcasm,节奏
748,预告片里的配音和正式版一样,neutral,配音
1142,颜色偏得离谱，画质翻车,negative,画质
1293,配音的口音地区错了，不地道,negative,配音
1058,剧情漏洞百出，看不下去,negative,剧情
1138,分辨率太低，1080p都救不了,negative,画质
1287,每一句话断句都不对，太累了,negative,配音
1748,这配音真震撼，震撼得我忘记剧情,sarcasm,配音
1303,前半段磨磨唧唧，后半段赶着投胎，差评,negative,节奏
1268,配音演员毫无辨识度,negative,配音
1230,这配音演员是睡着了吗，毫无情绪,negative,配音
470,主角智商在线，太帅了,positive,角色
1335,镜头切换影响了节奏，看着难受,negative,节奏
680,码率大概10Mbps,neutral,画质
1281,女主角的配音夹子音，听着好假,negative,配音
1704,这配音太专业了，跟电音有一拼,sarcasm,配音
1625,这噪点，完美复制雪花电视,sarcasm,画质
75,剧情毫无尿点，一直高能,positive,剧情
1569,剧情深度堪比短视频，三分钟就能看懂全部,sarcasm,剧情
547,剧情试图探讨人性与道德,neutral,剧情
1875,节奏感为零，还能这么自信,sarcasm,节奏
729,动画角色配音口型对得上,neutral,配音
631,色温设置在6500K,neutral,画质
851,这首歌的节奏刚好是每分钟120拍,neutral,节奏
1396,节奏太啰嗦，一句话翻来覆去讲,negative,节奏
597,剧情在某些处理上有些俗套，不算新颖,neutral,剧情
1186,黑位一塌糊涂，细节丢失,negative,画质
1415,男主强行装酷，油腻,negative,角色
1501,编剧的脑洞真大，逻辑却跟没有似的,sarcasm,剧情
375,直播节奏很舒服，不拖泥带水,positive,节奏
994,角色之前的经历一段都不记得了,neutral,角色
688,镜头边缘有轻微畸变,neutral,画质
1419,主角演技浮夸，出戏,negative,角色
103,这画面好细腻，每一帧都能当壁纸,positive,画质
1616,这画质真是细腻，连毛孔都一清二楚,sarcasm,画质
1869,节奏错误不断，反而显得很真实,sarcasm,节奏
604,色彩饱和度符合出厂设置,neutral,画质
1697,码率低到百度云都得压画质，诚意满满,sarcasm,画质
774,电影上映后有配音和原版两种选择,neutral,配音
377,节奏舒服，越看越带劲,positive,节奏
1525,神一样的节奏，拖到天荒地老,sarcasm,剧情
221,配音演员的表演很到位，张力十足,positive,配音
782,背景音和配音的音量比例合适,neutral,配音
115,细节特别丰富，画质绝对一流,positive,画质
1361,剪辑节奏太乱，根本连不上,negative,节奏
1841,节奏处理得真聪明，像在用慢动作展示蛇蜕,sarcasm,节奏
51,剧情的节奏把握得很好，没让我出戏,positive,剧情
1417,女主恋爱脑，烦,negative,角色
1246,配音毫无辨识度，分不清谁是谁,negative,配音
1709,这配音太棒了，让我更想关掉声音,sarcasm,配音
1347,打戏段落节奏太碎，不连贯,negative,节奏
498,那个小跟班角色也太可爱了吧，想rua,positive,角色
585,每一集都独立成章,neutral,剧情
1799,配音节奏掌控完美，完美到催人入睡,sarcasm,配音
143,夜景画面也很清晰，没有涂抹感,positive,画质
1643,动态范围真大，亮瞎眼和伸手不见五指,sarcasm,画质
427,这个反派演得太有魅力了，让人恨不起来,positive,角色
661,动态画面无拖影,neutral,画质
1696,宽银幕比例压扁人脸，个个都是大饼兄弟,sarcasm,画质
1949,女主牺牲真感人，下一集就可以复活继续玩,sarcasm,角色
1560,能把简单故事讲得这么复杂，也是种才华,sarcasm,剧情
992,配角共有五名主要成员,neutral,角色
388,节奏不紧不慢刚刚好,positive,节奏
1437,角色的动机都是强行加的，特别生硬,negative,角色
923,男二号是一位体育老师，体型比较壮,neutral,角色
244,爱上这个配音了，软糯又坚定,positive,配音
1210,配音语速过快，像赶场子,negative,配音
1721,这配音太自然了，自然到像念稿,sarcasm,配音
1275,配音完全不带感情,negative,配音
850,语速节奏适中听感好,neutral,节奏
1177,这画质也太差了吧，像蒙了一层雾,negative,画质
476,这个角色太有魅力了，每次出场都让我激动,positive,角色
354,动作戏的节奏感超级棒,positive,节奏
1336,情节推进节奏太慢，等得心烦,negative,节奏
772,有些配音听起来像是同一个人,neutral,配音
854,44拍的节奏保持了整首曲子,neutral,节奏
7,情节跌宕起伏，看得我心跳加速,positive,剧情
1158,色彩失真严重,negative,画质
1679,像素感人，每个镜头都是经典马赛克艺术,sarcasm,画质
973,主角的服装颜色以冷色调为主,neutral,角色
552,剧情让受害者家属的戏份增多,neutral,剧情
870,钢弦吉他节奏始终均匀,neutral,节奏
355,每集节奏都很紧凑，停不下来,positive,节奏
228,声线好迷人，每一句都听得入神,positive,配音
276,这配音演员配得太有感情了,positive,配音
1898,节奏真是独一无二，让我第一次觉得时间如此漫长,sarcasm,节奏
1527,太精彩了，每一个意外都恰巧出现在需要的地方,sarcasm,剧情
1557,冲突处理太高级了，反正解决不了就靠主角光环,sarcasm,剧情
1514,剧情悬疑得连老天都猜不透，谁想谁脑残,sarcasm,剧情
950,他和主角有三次直接对话,neutral,角色
233,配音超级贴脸，爱了爱了,positive,配音
1247,听了几分钟，配音就像催眠曲,negative,配音
1521,如此巧妙的剧情，巧合到编都编不出来,sarcasm,剧情
781,每个角色的配音声音区分度一般,neutral,配音
893,剪辑节奏改变了，让故事更紧凑,neutral,节奏
1365,叙事节奏很迷，看得好困,negative,节奏
1545,多出乎意料啊，反派突然忏悔那幕拯救了整部剧,sarcasm,剧情
176,画质太清晰了，用来看电影简直享受,positive,画质
1904,这个角色太有领导力了，带领全队走向团灭,sarcasm,角色
1659,画面细腻到我眼镜都花了,sarcasm,画质
1255,配音演员台词功底太差了,negative,配音
1555,剧情曲折得我直接快进，宝藏拖延法,sarcasm,剧情
1854,节奏卡点卡得我浑身难受，太棒了,sarcasm,节奏
1719,声优一定很辛苦，念得这么平平无奇,sarcasm,配音
1261,配音情感完全不对，差评,negative,配音
1985,不错，从头到尾都在秀下限,sarcasm,角色
588,剧情结构采用经典三幕式，起承转合完整,neutral,剧情
458,角色颜值和演技都在线,positive,角色
864,结尾节奏缓慢至自然衰减,neutral,节奏
971,角色之间的对话节奏很自然,neutral,角色
1910,配角的演技真是绿叶中的绿叶，绿叶都算不上,sarcasm,角色
454,角色塑造得很立体，好评,positive,角色
1447,主角哭戏像在笑，完全没有感染力,negative,角色
721,电影的配音在美国先录制后传输到这里,neutral,配音
86,故事走向很顺畅，看着舒服,positive,剧情
1858,节奏设计得真独特，完全猜不到下一拍,sarcasm,节奏
1928,这反派智商真高，每次计划都把自己坑死,sarcasm,角色
1686,景深处理绝了，背景虚化得像得了白内障,sarcasm,画质
1454,那个配角老是抢戏，看着就烦,negative,角色
583,台词偶尔出现方言,neutral,剧情
1867,节奏如此随性，真是自由奔放,sarcasm,节奏
360,整体节奏很快，符合我的口味,positive,节奏
292,大气磅礴的配音,positive,配音
422,这个角色简直就是我的互联网嘴替,positive,角色
1922,角色的情感转变好细腻，一秒从爱到恨,sarcasm,角色
59,每一集都像在解开一个谜,positive,剧情
146,画面锐利，轮廓非常清晰,positive,画质
834,前置镜头下呼吸节奏清晰,neutral,节奏
1657,不愧是4K画质，连马脸都一清二楚,sarcasm,画质
1187,动态画面拖影严重,negative,画质
1933,女主的人设真有创意，花瓶升级成电冰箱,sarcasm,角色
1172,屏幕全是格子,negative,画质
1328,节奏混乱，完全跟不上,negative,节奏
85,这么棒的故事谁能不爱,positive,剧情
1025,剧情最后强行大团圆，太假了,negative,剧情
653,拍摄画面比较清楚,neutral,画质
1622,色调这么高级，蓝不蓝绿不绿的,sarcasm,画质
686,颜色偏暖一点点,neutral,画质
732,这位配音演员的声线变化不明显,neutral,配音
581,配角故事线占比均衡,neutral,剧情
872,鼓桥与主播放出的节奏脱轨是常见叠音操作,neutral,节奏
866,数据处理显示鼓刷复合节奏变化,neutral,节奏
495,每个角色都像是真实存在的，共情了,positive,角色
707,几个主角的配音用了不同的音色区分,neutral,配音
1033,情节设计得太幼稚了,negative,剧情
189,画质表现超出预期，非常满意,positive,画质
1387,剧情节奏慢得像PPT，没耐心了,negative,节奏
1223,配音气若游丝，听不清,negative,配音
461,这个角色太逗了，好喜欢,positive,角色
1891,好厉害的节奏，每一拍都踩在我的雷点上,sarcasm,节奏
846,舞蹈节奏感很强,neutral,节奏
136,画质清晰度超出预期,positive,画质
246,对手戏配音也很棒，互动自然流畅,positive,配音
323,剪辑节奏太好了，行云流水,positive,节奏
1856,节奏忽快忽慢，真有艺术感,sarcasm,节奏
141,每一帧都可以截图当壁纸,positive,画质
1181,1080p都这么差？码率太低,negative,画质
1870,用这种节奏，真是对我们的折磨,sarcasm,节奏
34,剧情循序渐进，越看越有味,positive,剧情
1863,一会儿快一会儿慢，节奏控制真到位,sarcasm,节奏
332,这么快就完了？节奏好到我都没察觉,positive,节奏
16,被剧情深深吸引了，好评,positive,剧情
1700,这画质清晰到能把编剧的皱纹都拍出来,sarcasm,画质
1456,角色塑造太扁平了，毫无深度,negative,角色
496,刚想吐槽，结果角色马上打脸，设定还合理,positive,角色
1368,剧情节奏像蜗牛，劝退,negative,节奏
1800,听这配音，我决定以后只看默片,sarcasm,配音
1723,配音太有特色了，分不清谁是谁,sarcasm,配音
268,连呼吸声都配得恰到好处,positive,配音
958,这个角色似乎没有特别突出的特点,neutral,角色
1564,这剧情不烧脑，它直接烧CPU,sarcasm,剧情
1958,角色刻画得真细致，连内心戏都省了,sarcasm,角色
1090,剧情毫无逻辑，主角行为怪诞,negative,剧情
55,剧情设定新颖，不落俗套,positive,剧情
1509,多亏了这剧情，我重新认识了什么叫无聊,sarcasm,剧情
1102,色彩失真严重，感觉像是十几年前的显示器,negative,画质
530,剧情把几个不同的线索编织在一起,neutral,剧情
1655,亮度调得真好，夜里跟白天一样刺眼,sarcasm,画质
1600,情节推进完全按照演员档期修改，真是现实主义之作,sarcasm,剧情
1404,反派演得太假，一点压迫感都没有,negative,角色
1496,每次看到这个角色就想快进,negative,角色
1376,剧情拖拖拉拉，看得我快睡着了,negative,节奏
1333,节奏太松散，沉闷得想快进,negative,节奏
602,画面细节在标准范围内,neutral,画质
1664,动态范围惊人，亮部过曝暗部死黑,sarcasm,画质
171,画质细腻到毛孔都能看见,positive,画质
1631,这画质，每一帧都是壁纸级的渣,sarcasm,画质
1790,这声音配得太贴近角色了，毫无违和感,sarcasm,配音
1763,牛逼的配音，能让人静下心来看字幕,sarcasm,配音
1523,剧情实在精彩，建议睡觉时观赏,sarcasm,剧情
503,剧情从开始到结尾都很平稳,neutral,剧情
805,第二幕节奏稍微拖沓,neutral,节奏
29,故事结构精巧，伏笔回收感动到哭,positive,剧情
1584,剧情整体性太强了，每一部分都紧密围绕无聊这个核心,sarcasm,剧情
1405,主角光环太重，不合理,negative,角色
1804,节奏感太强，心脏受不了,sarcasm,节奏
703,动画里的配音没有明显破音或杂音,neutral,配音
1280,配音的情感表达很做作，听着难受,negative,配音
1905,女主角的颜值让人过目不忘，可惜演技连颜值都不如,sarcasm,角色
832,钢琴曲的节奏变化明显,neutral,节奏
197,色彩浓郁不刺眼，画质一级棒,positive,画质
761,一些角色的配音显得有点平,neutral,配音
414,日常互动甜到蛀牙,positive,角色
484,最喜欢那个看似高冷实则暖心的角色,positive,角色
1490,角色之间的关系发展得太突兀,negative,角色
1343,这块儿节奏突然断了，接不上,negative,节奏
794,这个配音在不同的播放设备上表现一致,neutral,配音
1632,画质好棒，我差点以为是在看马赛克,sarcasm,画质
1311,不知道导演怎么想的，节奏这么奇怪,negative,节奏
310,特别喜欢这种慢节奏的感觉，舒缓治愈,positive,节奏
1080,看到一半就猜到了结局，剧情太俗,negative,剧情
469,这个角色太可爱了，心化了,positive,角色
1732,配音真用功，字字都像在念课文,sarcasm,配音
1544,循序渐进慢慢推进，直到把人无聊到怀疑人生,sarcasm,剧情
645,HDR模式目前是关闭状态,neutral,画质
1104,暗部细节全没了，黑乎乎一片,negative,画质
567,导演用蒙太奇表现时间流逝,neutral,剧情
1065,剧情太多槽点，疯狂想吐槽,negative,剧情
556,剧情中出现了几个新人物,neutral,剧情
828,这段鼓点的节奏变化多端,neutral,节奏
1803,跟不上这节奏，是我反应太慢了,sarcasm,节奏
357,节奏张弛有度，看着舒服,positive,节奏
159,动态范围很大，明暗过渡舒服,positive,画质
1463,群演毫无存在感像木头人,negative,角色
549,剧情通过信件揭示真相,neutral,剧情
384,喜欢这个节奏，不拖沓不急促,positive,节奏
955,他这次演的角色和以前差不多,neutral,角色
298,甜美声线配的恰到好处,positive,配音
856,节奏由慢变快只用了两小节,neutral,节奏
1154,这画质真是让人无语,negative,画质
797,配音听起来像是用到了鼻音,neutral,配音
1547,太行了，关键线索被主角看到后硬是装没看见,sarcasm,剧情
185,画质好到爆，每一帧都像壁纸,positive,画质
1250,配音连基本的情感波动都没有，差评,negative,配音
569,剧中穿插了日记内容,neutral,剧情
808,BPM大概120左右,neutral,节奏
646,曝光补偿数值为0.3EV,neutral,画质
1208,这配音跟没吃饭一样，软弱无力,negative,配音
202,这片子的配音真的绝了，情绪到位,positive,配音
1973,女主角善良极了，整天给别人添麻烦,sarcasm,角色
325,剧情发展节奏不错，很会讲故事,positive,节奏
1169,细节全没了，毫无质感,negative,画质
1977,这演技绝了，全程就一个表情,sarcasm,角色
127,这画质细腻得让人惊喜,positive,画质
1478,女主角的演技太浮夸了，看着尴尬,negative,角色
247,国配之光，再听一百遍都不腻,positive,配音
734,孩子角色的配音听起来是成年人模仿的,neutral,配音
312,最近看的剧里节奏最舒服的一部,positive,节奏
759,这部剧使用了很多配音演员,neutral,配音
1477,主角光环太严重，完全不真实,negative,角色
559,剧情让每个角色有关联,neutral,剧情
1546,每个转折都精确计算，让人从心底里佩服编剧的勇气,sarcasm,剧情
557,剧情的一开始就设定悬念,neutral,剧情
441,女主角的个性洒脱不羁，太爱了,positive,角色
1707,这声线，绝了，跟AI有一比,sarcasm,配音
916,剧中的警长性格和平时，办案能力一般,neutral,角色
756,配音演员的声音辨识度很高,neutral,配音
1780,配音员是不是没睡醒，慵懒到极致了,sarcasm,配音
1921,为这个角色的逻辑鼓掌，和剧情一样不通,sarcasm,角色
1199,白平衡不准，要么偏蓝要么偏黄,negative,画质
1963,角色设定太棒了，一个纯粹的蠢货,sarcasm,角色
843,这部剧的节奏稍微快点更好,neutral,节奏
1041,剧情转折太假，为了反转而反转,negative,剧情
938,该角色使用一把长剑作为武器,neutral,角色
404,这反派气场两米八,positive,角色
6,故事讲得真好，情感真挚,positive,剧情
933,他的服装以黑色为主,neutral,角色
1473,女主全程一张苦瓜脸毫无变化,negative,角色
1204,配音感情不到位，很假,negative,配音
1936,演员真敬业，连哭戏都得靠眼药水全程赞助,sarcasm,角色
117,这画质也太清晰了吧，惊艳了,positive,画质
951,这个角色出场时间不多，但戏份很关键,neutral,角色
1781,听这配音仿佛在背课文，节奏感绝了,sarcasm,配音
284,这份配音太经典了,positive,配音
1851,这节奏快得我心脏都要跳出来了，真厉害,sarcasm,节奏
932,妆容方面用了较深的眼影,neutral,角色
1987,太感动了，角色成长就是从一个傻子变成另一个傻子,sarcasm,角色
462,角色成长线写得真好,positive,角色
463,被主角的勇敢圈粉了,positive,角色
1663,画质太优秀，我特意买了新显卡来看PPT,sarcasm,画质
393,节奏把控恰到好处,positive,节奏
1551,这编剧的逻辑真棒，主角失忆得比金鱼还快,sarcasm,剧情
1159,分辨率低得没法看,negative,画质
405,男主的眼神戏全是戏,positive,角色
1666,场景精良到我自己都看不下去,sarcasm,画质
218,声音的层次感很丰富，动听,positive,配音
50,一个个谜团慢慢解开，太过瘾了,positive,剧情
1432,主角的行为逻辑混乱，完全没法理解,negative,角色
1030,后期剧情越来越无聊,negative,剧情
1579,这故事线设计得精致到完美跑题，新颖得让人目瞪口呆,sarcasm,剧情
1475,就连老演员在这剧里也水土不服,negative,角色
1785,配音演员辛苦了，但建议换个工作,sarcasm,配音
1240,主角配音那么呆，配不上这剧情,negative,配音
269,配音台词功底也太扎实了,positive,配音
1330,前半段节奏太急促，后面又变慢，怪怪的,negative,节奏
1621,4K画质，效果堪比VCD,sarcasm,画质
603,亮度调节到50%时显示正常,neutral,画质
1689,分辨率高得把字幕都压扁了，字体真艺术,sarcasm,画质
1783,这声音配得太精确了，精确到像AI,sarcasm,配音
317,运镜加上节奏，简直享受,positive,节奏
255,声音和画面配合得恰到好处,positive,配音
251,这个配音太贴角色了，听着好舒服,positive,配音
1272,给这部剧配音的人是不是在敷衍,negative,配音
385,节奏很棒，沉浸感拉满,positive,节奏
754,配音版和原声版各有特色,neutral,配音
981,配角的戏份集中在开头和结尾,neutral,角色
1094,剧情极其狗血，侮辱智商,negative,剧情
1765,配音好有特色，像极了棒读现场,sarcasm,配音
1981,真深刻，这个人物从头到尾都在自说自话,sarcasm,角色
1581,情节安排妙绝伦，每个巧合都精准诠释了什么叫做硬核巧合,sarcasm,剧情
1011,剧情进展太慢，我快进着看完的,negative,剧情
133,画质提升明显，旧片也能看新感觉,positive,画质
1570,悬疑设置绝了，真相就是没真相,sarcasm,剧情
1526,这剧情真是让人拍案叫绝，怎么就想得出这么完美的逻辑漏洞,sarcasm,剧情
1842,一本正经的节奏，适合治疗失眠,sarcasm,节奏
1124,这块屏幕怕是回收的，像素点都坏了,negative,画质
1944,反派确实很有魅力，至少他有自知之明：是草包,sarcasm,角色
1583,编剧真是良苦用心，把所有观众都当成了推理大师防不胜防,sarcasm,剧情
58,情节发展自然流畅，舒服,positive,剧情
874,检测到了三种采样率相关的节奏时钟,neutral,节奏
1835,喜欢这种拖沓的节奏，正好练耐心,sarcasm,节奏
509,整个故事用了倒叙手法,neutral,剧情
1831,节奏这么好，害得我每次都得暂停去厕所,sarcasm,节奏
1052,这个剧情太扯了，逻辑不通,negative,剧情
1827,慢节奏就是好，能让人安心睡个觉,sarcasm,节奏
505,剧本改编自原著小说,neutral,剧情
1706,配音感情充沛到像在读课文,sarcasm,配音
708,这款游戏的配音录制于录音棚,neutral,配音
1888,节奏真是用心，用力过猛到令人感动,sarcasm,节奏
632,镜头光圈值为f/2.8,neutral,画质
1505,好一个神剧情，开始即巅峰，后面全是斜坡,sarcasm,剧情
974,配角在关键时刻帮助了主角,neutral,角色
226,配音演员的声音太有磁性了，听着超舒服,positive,配音
1778,配音老师一定很努力，但努力错了方向,sarcasm,配音
928,角色档案显示年龄是25岁,neutral,角色
620,肤色还原偏自然色调,neutral,画质
119,白天和夜景都拍得好清楚,positive,画质
895,游戏里每个关卡的节奏设计不同,neutral,节奏
1588,结局令人百思百叹，原来终极反派被晾了那么多集是要留白美,sarcasm,剧情
1587,梗这讲述，情节毫无说服力，所有踩点却每次都滑稽,sarcasm,剧情
1421,男主感情线写得莫名其妙,negative,角色
1134,颗粒感太重了，体验极差,negative,画质
1506,剧情转折比过山车还刺激，就是吓得想吐,sarcasm,剧情
1599,剧情看起来每一步都很精妙直到想起主角突然拥有超能力,sarcasm,剧情
428,女主角的气质完全符合原著，非常喜欢,positive,角色
961,配角名单里出现了几个新名字,neutral,角色
1422,只有主角在秀，其他人消失,negative,角色
1339,整体节奏特别平，没有起伏,negative,节奏
741,反派配音语气比较阴沉,neutral,配音
343,电影的推进节奏和配乐高度契合，绝了,positive,节奏
619,夜景模式曝光时间约3秒,neutral,画质
1784,配音水平真高，高到让人怀疑人生,sarcasm,配音
107,清晰到能看到毛孔，太赞了,positive,画质
1194,画面总是有微小的跳动,negative,画质
806,舞曲鼓点很密集,neutral,节奏
1550,最后强行圆满，全剧唯一的逻辑就是你没脾气,sarcasm,剧情
924,女主角的设定是年龄二十出头，刚毕业,neutral,角色
719,配音演员在录制时用了气息控制,neutral,配音
1075,剧情夸张到失真，完全无法代入,negative,剧情
1874,节奏又快又乱，真是首好听的歌,sarcasm,节奏
223,配音和背景音乐搭配得天衣无缝,positive,配音
1715,这配音绝了，比预告片里还差,sarcasm,配音
540,剧情用倒叙方式讲了凶手的心路,neutral,剧情
1549,所有巧合都安排得那么刻意，但这是你最爱的电视剧,sarcasm,剧情
1282,配音的语速忽快忽慢，很不自然,negative,配音
1257,配音感觉很廉价,negative,配音
1609,动态范围大到一片漆黑,sarcasm,画质
578,剧情中有几个省略号,neutral,剧情
1644,镜头畸变，人脸都压扁了，搞笑,sarcasm,画质
1694,对比度高得像黑白电影，连肤色都省了,sarcasm,画质
626,屏幕分辨率是1920×1080,neutral,画质
173,画面通透，色彩饱满,positive,画质
1241,配音明显气息不足，录音质量也差,negative,配音
1019,剧情设计不合理，主角光环太强,negative,剧情
1129,画质差劲，雷死人,negative,画质
466,角色台词功底太强了,positive,角色
1452,女主就是个花瓶，全程面无表情,negative,角色
1629,4K画质，连字体都糊成一团,sarcasm,画质
609,HDR模式开启后暗部细节显示,neutral,画质
1262,配音太刻意，不自然,negative,配音
1061,剧情混乱，人物关系都理不清,negative,剧情
858,这首歌的节奏是复合拍子,neutral,节奏
1843,节奏堪比瀑布，但打在一个平地上,sarcasm,节奏
435,每一个角色都有血有肉，喜欢,positive,角色
1674,帧生成技术真棒，黏黏糊糊让人想吐,sarcasm,画质
