id,text,label,aspect
1994,真强大，这角色的光环厚到能防弹,sarcasm,角色
1542,这处理绝了，把我们的智商按在地上来回碾压,sarcasm,剧情
501,这个故事讲述了主角的成长历程,neutral,剧情
1116,这画质还不如我老家的电视，后悔看了,negative,画质
835,游乐场音乐节奏欢快,neutral,节奏
903,主角有个双胞胎哥哥，剧情里会出现,neutral,角色
1313,整部电影节奏混乱，看起来累死了,negative,节奏
368,节奏舒服，不会太快也不会太慢,positive,节奏
1789,配音发音真标准，标准得像播报新闻,sarcasm,配音
845,两段音乐的节奏衔接自然,neutral,节奏
1326,节奏拖沓，看得我很煎熬,negative,节奏
915,男配是个音乐人，会拉小提琴,neutral,角色
1724,这配音真棒，让我想切日语,sarcasm,配音
175,画质太好了，换新设备后惊喜,positive,画质
532,剧情中后期有些反复，但不算拖沓,neutral,剧情
1412,女二绿茶婊，看得火大,negative,角色
83,情节设置好巧妙，佩服,positive,剧情
1533,太佩服了，所有线索都聚集在一起显得毫无用处,sarcasm,剧情
1043,单薄的剧情，撑不起电影,negative,剧情
1338,节奏控制失败，高潮前就泄了气,negative,节奏
524,剧情中的事件前后关联紧密,neutral,剧情
1606,清晰度绝了，连汗毛都能数出来？骗鬼呢,sarcasm,画质
1221,配音情感过于高涨，夸张,negative,配音
1681,这画质让我回到用压缩包看电影的年代,sarcasm,画质
423,温柔病娇太好磕了,positive,角色
650,系统设置了视频的码率为10Mbps,neutral,画质
145,动态画面没有拖影，看着爽,positive,画质
1324,剪辑点全错，节奏彻底垮掉,negative,节奏
1200,色彩断层明显，渐变色惨不忍睹,negative,画质
1537,真是神来之笔，把明摆着的道理用最绕的方式讲完,sarcasm,剧情
200,画面清晰，色彩自然，看着好舒服,positive,画质
1220,配音对白不自然，跟朗诵似的,negative,配音
1779,这声音配得太好了，好到我想关静音,sarcasm,配音
1299,台词的配音和嘴型对不上，难受,negative,配音
520,主要的剧情线讲得比较清楚,neutral,剧情
1735,配音效果拔群，拔群到画面都配不上声音,sarcasm,配音
900,晚会节目的节奏衔接顺畅,neutral,节奏
1133,白瞎了这么好的故事，画质跟不上,negative,画质
148,画质一直这么稳，好评,positive,画质
478,温柔又强大，简直是我的理想型,positive,角色
1427,主角性格也太单薄了，毫无深度,negative,角色
1256,这部剧配音毁了一切,negative,配音
792,配音在处理长句子时气息方面稍有不足,neutral,配音
988,男主角的武器是一把剑,neutral,角色
957,男二号在剧中做了重要作用,neutral,角色
563,整部剧采用了倒叙手法,neutral,剧情
625,抗锯齿处理效果中等,neutral,画质
383,节奏完美，越看越上头,positive,节奏
1201,配音太出戏了，完全无法入戏,negative,配音
1173,灰度层次不行，画面扁平,negative,画质
1695,慢镜头拍到演员眨眼都卡顿，时间感太强,sarcasm,画质
1998,这角色真神奇，总能干出最蠢的事,sarcasm,角色
1024,剧情幼稚低龄化，根本看不下去,negative,剧情
1003,剧情老套，毫无新意，失望,negative,剧情
456,主角光环太耀眼了，吸粉,positive,角色
1630,噪点艺术，很有胶片感啊,sarcasm,画质
1016,剧情后半段直接崩了，前面白铺垫,negative,剧情
514,剧情里有一些转折，但不算意外,neutral,剧情
160,播放高清流畅，画质保障,positive,画质
1078,剧情老套，毫无新意,negative,剧情
24,剧情让人眼前一亮，不套路,positive,剧情
1507,剧本写得真好，一点也不落俗套，俗套都被玩烂了,sarcasm,剧情
1382,节奏问题严重，看得人烦躁,negative,节奏
621,电影模式背景虚化可调,neutral,画质
12,剧情吸引人，一口气看完,positive,剧情
1354,前半段拖沓，后半段又赶场，无语,negative,节奏
1470,所有配角都像是背景纸板,negative,角色
1895,节奏堪称经典，绝对是枯燥的典范,sarcasm,节奏
1140,画面抖动加模糊，观感极差,negative,画质
1465,女主角就是个恋爱脑，人设不行,negative,角色
833,文章每个段落的节奏一样,neutral,节奏
1229,配音和口型对不上，观感极差,negative,配音
1036,故事讲得乱七八糟的,negative,剧情
1297,配音的音量忽大忽小，调教一下,negative,配音
1449,反派智商不在线，拉低整部剧水平,negative,角色
61,剧情让我跟着主角一起哭一起笑,positive,剧情
81,故事讲得真有意思,positive,剧情
1826,这节奏快得飞起，剪辑师是开了倍速吧,sarcasm,节奏
1846,完美节奏，除了睡觉时还能感知到生降,sarcasm,节奏
730,配音的感情表达差不多就那样,neutral,配音
424,全员恶人演得过瘾,positive,角色
935,这个角色的设定是反派,neutral,角色
1734,配音演员感情丰富，丰富得像个机器人,sarcasm,配音
1649,色彩简直辣眼睛，高饱和战士,sarcasm,画质
266,配音让角色灵魂感更强了,positive,配音
111,屏幕鲜艳生动，视觉体验超棒,positive,画质
1494,服装道具太不用心了,negative,角色
1362,节奏拖沓，剧情贫乏，无聊,negative,节奏
539,剧情里的时间线略有跳跃,neutral,剧情
1468,男三号的作用就是注水,negative,角色
1878,这节奏感太强了，强到让我差点睡着,sarcasm,节奏
879,这个游戏的战斗节奏偏慢，需要耐心,neutral,节奏
941,剧中这个角色的职业是教师,neutral,角色
1039,情节发展毫无逻辑可言,negative,剧情
56,伏笔回收得特别巧妙,positive,剧情
523,故事的情节保持了一致性,neutral,剧情
1203,声音和角色完全不搭，尴尬,negative,配音
728,旁白配音语速适中，能听清,neutral,配音
314,节奏控制得太赞了，沉浸感强,positive,节奏
1176,画质模糊，看着眼睛疼,negative,画质
1285,配音老是看着字幕念，感觉好敷衍,negative,配音
215,这配音真的注入灵魂了，太棒了,positive,配音
1816,节奏感这么强一定很贵吧,sarcasm,节奏
450,支持角色每一个决定，觉得都很合理,positive,角色
243,配音特别有质感，沙哑声线很迷人,positive,配音
1385,前半段拖沓，后半段赶进度，节奏失衡,negative,节奏
577,结局是开放式的,neutral,剧情
1962,主角思维真敏捷，半天憋不出一句话,sarcasm,角色
1226,配音怎么这么僵硬，感情都白瞎了,negative,配音
1605,色彩鲜艳得我都想戴墨镜看了,sarcasm,画质
1755,这声音，一听就知道是ai配的吧,sarcasm,配音
838,健身操的节奏需要稳定,neutral,节奏
606,噪点在暗部场景下可见,neutral,画质
1558,豆瓣8分的神作，全靠同行衬托,sarcasm,剧情
283,配音很有感染力,positive,配音
801,这歌前奏有点长,neutral,节奏
829,故事的节奏由慢到快,neutral,节奏
489,男主的性格也太讨喜了，小缺点反而可爱,positive,角色
271,情绪随着声音起伏，入戏了,positive,配音
1812,节奏好得我每隔十秒看一次时间,sarcasm,节奏
763,主要角色的配音都比较稳定,neutral,配音
1692,这画质适合盲人观看，反正看清了更难受,sarcasm,画质
1425,酱油角色太多，拖节奏,negative,角色
1144,画质渣到怀疑人生,negative,画质
515,电视剧的剧情走向基本能猜到,neutral,剧情
1762,这配音真是走心，让我彻底出戏,sarcasm,配音
72,剧情发展顺畅，转折不生硬,positive,剧情
364,打斗场景的节奏特别爽,positive,节奏
986,配角阵容包括三位老戏骨,neutral,角色
26,这剧情节太棒了，一路反转熬夜追完,positive,剧情
1925,女主角的勇气可圈可点，专门坑队友,sarcasm,角色
1517,剧情跌宕起伏，像心电图一样平,sarcasm,剧情
1082,剧情根本没深度，就是无脑爽,negative,剧情
548,剧情的场景设计符合年代,neutral,剧情
1972,男主正义感爆棚，专门欺负弱者,sarcasm,角色
1742,这配音好听死了，死得我赶紧调小音量,sarcasm,配音
183,这画质绝了，色彩饱满亮度适中,positive,画质
1408,女主全程苦瓜脸，厌烦,negative,角色
987,角色的服装颜色以蓝色为主,neutral,角色
79,情节反转出人意料，精彩,positive,剧情
1920,主角的性格太棒了，自私自利得很真实,sarcasm,角色
195,画面干净通透亮眼，画质满分,positive,画质
1389,这节奏也太沉闷了吧，犯困,negative,节奏
736,群杂配音声音比较小,neutral,配音
1513,这么创新的剧情，终于让我见识了老套的集大成,sarcasm,剧情
1887,优秀的节奏，让我对时间有了新的认识,sarcasm,节奏
529,这部剧的剧情结构是常规的三幕式,neutral,剧情
124,色彩鲜艳但不失真，完美,positive,画质
1508,这种剧情发展，真是让人眼前一亮，然后一黑,sarcasm,剧情
667,对比度需要调一下吗,neutral,画质
778,配音和口型基本对得上，同步感可以,neutral,配音
1064,剧情节奏有问题，该快不快，该慢不慢,negative,剧情
27,剧本扎实，每场戏都推进得恰到好处,positive,剧情
1148,噪点满屏飞，画质负分,negative,画质
1301,剧情推进太拖沓了，节奏慢得让人想睡觉,negative,节奏
411,每个微表情都精准,positive,角色
302,节奏把控得真好，一点不拖沓,positive,节奏
1798,这配音让我学到了，原来可以这样配,sarcasm,配音
571,最后一集交代了所有伏笔,neutral,剧情
1764,太完美了，每个停顿都很刻意,sarcasm,配音
1359,节奏不行，毫无波澜,negative,节奏
345,这段剧情节奏收得好，余味悠长,positive,节奏
4,很喜欢这个故事的走向,positive,剧情
887,这个软件响应节奏有点慢，等待时间较长,neutral,节奏
671,色域覆盖了sRGB,neutral,画质
1342,工作汇报式的节奏，太干巴,negative,节奏
654,色彩还原度一般吧,neutral,画质
1828,节奏把握得太完美了，像看80集裹脚布,sarcasm,节奏
154,画质细腻，爱了爱了,positive,画质
1308,故事节奏失衡，重要情节一笔带过，无趣,negative,节奏
723,漫画改编动画的配音保持了原作性格,neutral,配音
607,对比度设置偏中间值,neutral,画质
1125,音画不同步就算了，画质还这么烂，双重暴击,negative,画质
716,这部剧的配音在日本也有原版声优,neutral,配音
1098,剧情前后矛盾，无法自圆其说,negative,剧情
909,女主的闺蜜是一个喜欢追剧的宅女,neutral,角色
1259,配音让人出戏,negative,配音
1959,女主角真是人见人爱，除了观众,sarcasm,角色
959,客串演员的角色占用了两集时间,neutral,角色
1063,剧情假大空，不接地气,negative,剧情
592,剧本改编自小说，保留了原文的主体框架,neutral,剧情
169,画质挺好，看着不累,positive,画质
337,笑点节奏很棒，我一个都没落下,positive,节奏
392,这节奏走心了啊，棒,positive,节奏
1087,剧情刻意煽情，适得其反,negative,剧情
121,色彩明快柔和，很喜欢这个色调,positive,画质
831,节目剪辑的节奏不够连贯,neutral,节奏
1806,节奏快得像赶着投胎，真有水平,sarcasm,节奏
184,清晰度很高，边缘处理得干净,positive,画质
1462,男主的性格窝囊得让人着急,negative,角色
1862,节奏感太强了，强到我觉得自己在蹦迪,sarcasm,节奏
425,角色弧光完整有说服力,positive,角色
613,色温调节有标准模式,neutral,画质
765,这部剧的配音是现场录制的,neutral,配音
1777,配音感情真充沛，比机器人还生动呢,sarcasm,配音
336,镜头切换节奏好利落，像专业剪辑师做的,positive,节奏
1163,边缘锯齿明显,negative,画质
1300,整体配音很失败，看完讨厌这部剧,negative,配音
1047,故事线太多了，剪得支离破碎,negative,剧情
1009,这剧情编的太随意了吧，根本不合情理,negative,剧情
306,这个节奏很舒服，恰到好处,positive,节奏
989,女主角的职业设定是医生,neutral,角色
8,剧情有深度，值得回味,positive,剧情
1380,节奏感全无，故事讲得支离破碎,negative,节奏
1337,节奏拖沓，剧情像在注水,negative,节奏
57,剧情饱满，没有多余废话,positive,剧情
1450,主角的服装廉价感十足，像地摊货,negative,角色
954,配角们的戏份分布比较平均,neutral,角色
579,章节标题呼应主题,neutral,剧情
1341,节奏太赶，情感铺垫不够,negative,节奏
1379,情节推进像蜗牛，急死人,negative,节奏
1836,节奏太快了，根本来不及思考这是什么东西,sarcasm,节奏
1749,配音效果一流，一流到不如没声音,sarcasm,配音
1756,太专业了，每个字都像在读课文,sarcasm,配音
1822,节奏感爆棚，不愧是票房毒药,sarcasm,节奏
1095,剧情架构松散，不知所云,negative,剧情
1076,剧情太拖沓，看得我想睡觉,negative,剧情
155,分辨率高，每一个细节都看得清,positive,画质
203,配音和角色完美契合，听着就舒服,positive,配音
126,画质太棒了，清晰得能数清叶脉,positive,画质
1492,演技和其他演员完全不在一个层次,negative,角色
573,人物命运在结尾闭环,neutral,剧情
1651,色彩太鲜艳了，看得我眼睛都快瞎了,sarcasm,画质
666,饱和度没什么调整,neutral,画质
158,画质优秀，符合我的要求,positive,画质
873,节奏录制采用的是单一轨道,neutral,节奏
1593,悬念保持得真长久，到最后发现原来这诡计是耍着玩我们,sarcasm,剧情
551,剧情用了很多隐喻和象征,neutral,剧情
522,剧情的发展算是中规中矩,neutral,剧情
1374,剧情进展缓慢，节奏像挤牙膏,negative,节奏
541,剧情后半段加入一条支线,neutral,剧情
655,分辨率是1080p的,neutral,画质
166,细节丰富，放大也不模糊,positive,画质
1990,厉害，这个角色的逻辑简直是宇宙级混乱,sarcasm,角色
1771,就冲这配音，我决定去看原著,sarcasm,配音
701,这部剧的配音听起来挺清晰的,neutral,配音
442,看主角一步步成长，感觉自己也受了鼓舞,positive,角色
775,老电影有不少经典配音演员的作品,neutral,配音
790,配音的后期处理效果偏干,neutral,配音
1377,节奏太慢了，中间一度想弃剧,negative,节奏
342,整个游戏的节奏安排很合理，停不下来,positive,节奏
1086,剧情太薄弱，撑不起主题,negative,剧情
1556,真心感谢这剧情，治好了我的失眠,sarcasm,剧情
1574,剧情连续性太好了，处处断片连不上,sarcasm,剧情
1182,噪点太多，影响观看,negative,画质
867,中间有节奏重复连接了两段旋律,neutral,节奏
49,编剧把时间线玩得很溜，逻辑通顺,positive,剧情
1634,每一帧都能当表情包，清晰得离谱,sarcasm,画质
1821,节奏真是完美，就是有点想吐,sarcasm,节奏
1028,故事老套，毫无新意,negative,剧情
1992,太好了，这个角色让我养成了快进的习惯,sarcasm,角色
572,台词里有一些历史事件,neutral,剧情
1032,这片子剧情太散了，主次不分,negative,剧情
1848,感谢导演保留了古董般的叙事节奏,sarcasm,节奏
1083,剧情漏洞百出，太失望了,negative,剧情
180,4K画质就是牛，锐度恰到好处,positive,画质
460,主角太有魅力了，粉了,positive,角色
1857,这节奏也太稳了，稳得像没在动一样,sarcasm,节奏
1872,节奏简单到无语，返璞归真,sarcasm,节奏
1209,配音和人物年龄违和，硬配的,negative,配音
943,这个角色有养一只猫,neutral,角色
956,女主角的造型变化不大,neutral,角色
574,剧本节奏前慢后快,neutral,剧情
1153,画质差到影响观看体验,negative,画质
978,男主角的声优是新人,neutral,角色
902,这个角色的年龄设定在三十岁左右,neutral,角色
129,画面通透干净，亮度适中,positive,画质
1531,每一幕都感人肺腑，尤其是主角强行降智那段,sarcasm,剧情
403,女二的人设好绝,positive,角色
326,这节奏把控得太到位了，全程无尿点,positive,节奏
705,这片子的配音用了不少方言元素,neutral,配音
41,剧情真实不做作，代入感极强,positive,剧情
485,人物关系的描写细腻又有趣，笑死,positive,角色
1662,色彩饱和度很高，跟广告图一模一样,sarcasm,画质
1249,这配音语气扁平，让我失去了兴趣,negative,配音
521,这部作品的剧情没有太出人意料的地方,neutral,剧情
1654,细节太棒了，连毛孔都能看到，但是我晕,sarcasm,画质
1168,压缩痕迹太明显,negative,画质
242,配音员好专业，口齿清晰情感充沛,positive,配音
1566,转折比山路十八弯还硬，神作无疑,sarcasm,剧情
1647,啊，这画质让我想起老电影，抖得真实,sarcasm,画质
1440,角色互动毫无火花，全是塑料友谊,negative,角色
517,故事的发展线条清晰,neutral,剧情
694,背光补偿开启,neutral,画质
1164,画面发灰，像蒙了一层雾,negative,画质
702,配音演员的声音和角色形象比较吻合,neutral,配音
1927,主角演得真好，每集都在刷新智商下限,sarcasm,角色
182,画面精细，看着一点不累眼,positive,画质
555,剧情在梦境与现实之间切换,neutral,剧情
1520,剧情让人沉醉，醉得不省人事那种,sarcasm,剧情
1594,剧情越来越标新立异，每条缝里都藏着令人咋舌的逻辑链,sarcasm,剧情
1429,反派刻画得像小丑，一点威慑力没有,negative,角色
1235,配音后期是调音失败了吗，电流声好重,negative,配音
1809,节奏快到让我怀疑人生，厉害,sarcasm,节奏
370,整部戏节奏明朗，看着不累,positive,节奏
1635,这画质，完美展现了像素艺术,sarcasm,画质
1595,除了剧情本身我不满意，对剧情的打磨竟然都这么敷衍,sarcasm,剧情
1612,画质精良到像老电影，果然怀旧,sarcasm,画质
947,他的表情平静没有变化,neutral,角色
274,把角色的心理活动全用声音表达出来了,positive,配音
662,色温偏暖调一些,neutral,画质
303,喜欢这种紧凑的节奏，看得过瘾,positive,节奏
890,这支曲子节奏鲜明，容易记住旋律,neutral,节奏
48,叙事角度新颖，全程无尿点,positive,剧情
1986,真棒，这个角色完美诠释了什么叫不合理,sarcasm,角色
1619,饱和度调到炸裂，眼睛爽歪歪,sarcasm,画质
1196,景深效果没处理好，背景模糊一片,negative,画质
610,屏幕刷新率固定在60Hz,neutral,画质
1945,这角色演技精湛，将暴躁无能演绎出天际,sarcasm,角色
527,故事情节里的伏笔大多有合理解释,neutral,剧情
1113,这编码是省了多少钱，全是马赛克,negative,画质
904,反派是个很有钱的企业家，动机明确,neutral,角色
1637,色彩还原度真高，荧光色都普照了,sarcasm,画质
1996,完美人设，除了令人烦躁以外无可挑剔,sarcasm,角色
542,剧情中有不少闪回镜头,neutral,剧情
906,男二号是一名律师，性格比较内敛,neutral,角色
1101,这画质也太模糊了吧，完全看不清楚细节,negative,画质
199,显示效果惊艳，画质无可挑剔,positive,画质
258,这配音让人耳朵怀孕，太棒了,positive,配音
1291,配音不贴合人物，看着想快进,negative,配音
1416,配角全员工具人，没用,negative,角色
1207,声音忽大忽小，听感很差,negative,配音
1624,暗部细节丰富到啥也看不见,sarcasm,画质
66,被剧情感动到了，好看,positive,剧情
611,室内光线下的摄像头成像一般,neutral,画质
675,快门速度1/60秒,neutral,画质
507,剧情线索在前面几集就埋下了,neutral,剧情
304,每一集都高潮迭起，节奏无敌,positive,节奏
123,画质杠杠的，一点不模糊,positive,画质
205,这配音水平，听着就是一种享受,positive,配音
475,角色塑造得太细腻了,positive,角色
1975,主角进步神速，从头到尾一样差劲,sarcasm,角色
1753,配得真好，完全听不出原声的调调,sarcasm,配音
1580,剧情推进节奏掌握得太好了，连停顿都那么出人意料,sarcasm,剧情
369,插曲的节奏超带感,positive,节奏
952,主角的设定挺常见的，没有太多新意,neutral,角色
230,喜欢这个配音，和角色简直一模一样,positive,配音
630,动态范围在仪表上显示为12档,neutral,画质
412,团宠设定好可爱,positive,角色
285,配音清晰又有力度,positive,配音
1193,饱和度太高，颜色假,negative,画质
1318,开篇节奏还行，后面直线崩塌,negative,节奏
92,剧情起承转合自然，佳作,positive,剧情
1070,剧情无聊到快进都嫌浪费时间,negative,剧情
1639,摩尔纹设计，与蒙娜丽莎相媲美,sarcasm,画质
826,这个电影的节奏很紧凑,neutral,节奏
131,帧率高，动作流畅不卡顿,positive,画质
1001,剧情太拖沓了，看到后面直接弃剧,negative,剧情
783,配音的节奏保持得比较平稳,neutral,配音
824,多次切分带来不稳定感,neutral,节奏
1448,那个角色的道具枪像玩具，负分,negative,角色
1538,这么多伏笔都收得干净利落，就像随手扔掉的垃圾,sarcasm,剧情
807,最后五分钟加速了,neutral,节奏
1111,闪光场景全是噪点，颗粒感太重,negative,画质
1238,难道没有更好的配音了吗，太难受了,negative,配音
1512,剧情流畅得像个跛子，一步三晃,sarcasm,剧情
1746,配音功底深厚，深到听不清角色说话,sarcasm,配音
564,第6集有个反转桥段,neutral,剧情
739,女性配音和男性配音区分得很清楚,neutral,配音
600,剧情在展现人物关系方面比较到位,neutral,剧情
762,配音和画面的同步效果还可以,neutral,配音
1797,配音员很敬业，只是听众不敬业,sarcasm,配音
1908,男主角的勇气可嘉，每次都第一个逃跑,sarcasm,角色
1969,主角性格真突出，除了愚蠢没别的,sarcasm,角色
301,这剧节奏太棒了，追得停不下来,positive,节奏
1982,好厉害，这个角色的智商全程在线，就是没在点上,sarcasm,角色
1577,看了这剧情，我忍不住想给编剧鼓掌，能把简单事弄得这么复杂真不容易,sarcasm,剧情
905,女主角的职业是医生，最近开始值夜班,neutral,角色
656,视频编码是h.265,neutral,画质
531,故事的主线一直很明确,neutral,剧情
1808,每一秒都在反转，节奏大师啊,sarcasm,节奏
1722,声线无敌，每个角色都一个样,sarcasm,配音
1248,配音里杂音很多，明显后期没处理好,negative,配音
238,音色优美，感情丰富，太享受了,positive,配音
809,三拍子的华尔兹,neutral,节奏
1305,节奏忽快忽慢，让人完全进入不了状态,negative,节奏
1332,这个剪辑，节奏感全无,negative,节奏
196,细节保留得很好，画质出色,positive,画质
1917,台词功底深厚，念得跟读课文似的,sarcasm,角色
201,配音演员的声音太有感染力了,positive,配音
1371,差评，节奏处理极差,negative,节奏
1079,剧情的转折太生硬了，不自然,negative,剧情
430,主角的成长线刻画得很细腻，很感动,positive,角色
1773,配音员是照着拼音念的吗？太标准了,sarcasm,配音
1703,声线优美得让我想静音,sarcasm,配音
1585,矛盾设置何等巧妙，每个冲突都恰到好处地让人无感,sarcasm,剧情
1319,转场生硬，节奏卡得让人难受,negative,节奏
249,这个配音让人上瘾，根本停不下来,positive,配音
735,方言配音用了本地话,neutral,配音
43,节奏把握得刚好，不紧不慢看得很舒服,positive,剧情
1741,配音节奏感好，好得跟慢动作一样,sarcasm,配音
18,故事线清晰，非常精彩,positive,剧情
1592,情起先俗套转得倒顺畅，再看那些转折似乎没有意义,sarcasm,剧情
827,歌曲的节奏每分钟120拍,neutral,节奏
877,这歌的鼓点节奏很清晰,neutral,节奏
167,画质杠杠的，非常棒,positive,画质
711,这部作品的配音没有使用电子音处理,neutral,配音
1383,剧情发展像老太太裹脚布,negative,节奏
545,剧情让我联想到一些社会事件,neutral,剧情
979,反派角色戴着一副墨镜,neutral,角色
1850,这个节奏让人想起被卡在作业里的感觉,sarcasm,节奏
147,色彩调校很舒服，不偏色,positive,画质
1906,为主角的机智点赞，敌人还没动他就先送人头,sarcasm,角色
1149,画质太费眼睛了，不推荐,negative,画质
1068,剧情东拼西凑，像大杂烩,negative,剧情
892,直播间的互动节奏很快，消息刷屏,neutral,节奏
1071,剧情虎头蛇尾，结局草率,negative,剧情
1084,剧情编排不合理，感觉像拼凑的,negative,剧情
190,看高清视频首选，画质真没得挑,positive,画质
1796,这声音配得太有辨识度，谁都像又谁都不像,sarcasm,配音
639,感光度ISO参数为400,neutral,画质
432,角色之间的化学反应太棒了，火花四溅,positive,角色
1604,这画质真是感人，糊得我以为我近视了,sarcasm,画质
1017,剧情太狗血了，毫无逻辑可言,negative,剧情
1245,字幕和配音不同步，体验极差,negative,配音
561,开头三集交代了人物关系,neutral,剧情
208,配音演员把角色的性格特点都表现出来了,positive,配音
409,我宣布这是我本命角色,positive,角色
457,这个配角演得真出彩,positive,角色
875,现场的每个区段开动打击垫建立了节奏基底,neutral,节奏
1114,色彩过渡不自然，有断层,negative,画质
1000,这位角色的生日是六月一号,neutral,角色
220,好喜欢这个配音，温柔又坚定,positive,配音
1251,这配音也太做作了，听着难受,negative,配音
30,喜欢这个设定，既有深度又燃,positive,剧情
1392,节奏把控太差，忽快忽慢,negative,节奏
752,配音演员的口型对得挺准,neutral,配音
641,图像质量选项为正常压缩,neutral,画质
